text,aspect,polarity,lang
"PC users work in Word, while Mac users work in Pages.",Word,neutral,en
"PC users work in Word, while Mac users work in Pages.",Pages,neutral,en
"While I mostly use it for email, internet and gaming, I'm confident all other applications live up to the high standard I've come to appreciate from Mac laptops.",applications,pos,en
"While I mostly use it for email, internet and gaming, I'm confident all other applications live up to the high standard I've come to appreciate from Mac laptops.",internet,neutral,en
"While I mostly use it for email, internet and gaming, I'm confident all other applications live up to the high standard I've come to appreciate from Mac laptops.",gaming,neutral,en
"This laptop looks great on the surface: 17"" inch screen, good  price-point, nice appearance, boots up quickly, runs fast etc.","17"" inch screen",pos,en
"This laptop looks great on the surface: 17"" inch screen, good  price-point, nice appearance, boots up quickly, runs fast etc.",price-point,pos,en
"This laptop looks great on the surface: 17"" inch screen, good  price-point, nice appearance, boots up quickly, runs fast etc.",appearance,pos,en
"This laptop looks great on the surface: 17"" inch screen, good  price-point, nice appearance, boots up quickly, runs fast etc.",boots up,pos,en
"This laptop looks great on the surface: 17"" inch screen, good  price-point, nice appearance, boots up quickly, runs fast etc.",runs,pos,en
"The apple systems are over priced luxurys that arn't worth what they are being charged for, this model's specifications are far from being impressive and they only thing you get out of this is the apple name.",specifications,neg,en
"The apple systems are over priced luxurys that arn't worth what they are being charged for, this model's specifications are far from being impressive and they only thing you get out of this is the apple name.",over priced,neg,en
pros:  the macbook pro notebook has a large battery life and you wont have to worry to charge your laptop every five hours or so.,battery life,pos,en
Disappointing for such a lovely screen and at a reasonable price,screen,pos,en
Disappointing for such a lovely screen and at a reasonable price,price,pos,en
The only bad thing about it is they give you the worst batteries possible.,batteries,neg,en
Good price.,price,pos,en
THE MOTHERBOARD IS DEAD !,MOTHERBOARD,neg,en
the speed is fine.,speed,pos,en
Hmmm - that high failure rate sure isn't reflected in the retail price.,retail price,neg,en
"It was not clear that the Microsoft Student Edition that was loaded on the computer, was a six month trial.",Microsoft Student Edition,neg,en
Good for every day computing and web browsing.,web browsing,pos,en
Good for every day computing and web browsing.,every day computing,pos,en
"Also, I have had alot of trouble with the keys sticking and will not type correctly.",keys,neg,en
Excellent LED monitor and well equipped.,LED monitor,pos,en
This process continued to repeat itself until the mother board had been replaced 4 times and the hard drive replaced 3 times.,mother board,neg,en
This process continued to repeat itself until the mother board had been replaced 4 times and the hard drive replaced 3 times.,hard drive,neg,en
"Without a doubt, the *design* of this laptop is fantastic.",design,pos,en
I couldn't believe how long the battery lasted on a single charge.,battery,pos,en
I couldn't believe how long the battery lasted on a single charge.,charge,pos,en
I could save ten essay papers and have hardly any memory left.,memory,neg,en
"Other than that, I would recommend this to someone in need of a cheap laptop with semi-decent gaming capabilities.",gaming,pos,en
"This is the first time that I tried and owning a netbook although I have used 3 different laptops in the past 10 years, I find not much difference except of course for the screen size.",screen size,neutral,en
But the biggest pain is that tech support is not available 24/7.,tech support,neg,en
The backlit keys are wonderful when you are working in the dark.,backlit keys,pos,en
"I chose the iBookG4, a laptop that is an attractive computer with a large screen big enough to please anyone.",screen,pos,en
"The most recent being that my Safari internet browser is freaking out on me, but I have just been using firefox instead.",Safari internet browser,neg,en
"The most recent being that my Safari internet browser is freaking out on me, but I have just been using firefox instead.",firefox,pos,en
"Everything about the Mac is not only visually appealing, but very easy to use.",use,pos,en
I know what 7 hrs of battery looks like.,battery,pos,en
I did not have to call the support line at all.,support line,neutral,en
The laptop is outstanding in all aspects except that it has the Windows 7 starter and not the full Windows 7.,Windows 7 starter,neg,en
The laptop is outstanding in all aspects except that it has the Windows 7 starter and not the full Windows 7.,Windows 7,pos,en
THE FIRST PROBLEM IS THAT THE KEYBOARD FUNCTION IS SIMPLY UNSATISFACTORY.,KEYBOARD FUNCTION,neg,en
"The DVD drive randomly pops open when it is in my backpack as well, which is annoying.",DVD drive,neg,en
"Garageband is more for the musicians, and the laptop is equipped with a good working microphone, good enough for beginners and musicians at the intermediate level.",Garageband,neutral,en
"Garageband is more for the musicians, and the laptop is equipped with a good working microphone, good enough for beginners and musicians at the intermediate level.",microphone,pos,en
I dual boot with Linux and that other security-prone OS and it performs flawlessly.,Linux,neutral,en
I dual boot with Linux and that other security-prone OS and it performs flawlessly.,security-prone OS,neutral,en
I dual boot with Linux and that other security-prone OS and it performs flawlessly.,performs,pos,en
The difference is the Toshiba had a lot more memory and hard drive space.,memory,pos,en
The difference is the Toshiba had a lot more memory and hard drive space.,hard drive space,pos,en
There was a little difficulty doing the migration as the firewire cable system can't be used with the iBook.,firewire cable system,neg,en
There was a little difficulty doing the migration as the firewire cable system can't be used with the iBook.,iBook,neutral,en
Seems like maybe a bad shipment from Toshiba.,shipment,neg,en
OS X is solid with lots of innovations such as quicklook which save heaps of time.,OS X,pos,en
OS X is solid with lots of innovations such as quicklook which save heaps of time.,quicklook,pos,en
But other than that I am blown away by all the features this laptop offers.,features,pos,en
The keyboard is slick and quiet and not bulky like some other laptops I have had in the past.,keyboard,pos,en
"Overall, this laptop is definitely a keeper with its simple yet stylish design and its array of fantastic colors to choose from.",design,pos,en
"Overall, this laptop is definitely a keeper with its simple yet stylish design and its array of fantastic colors to choose from.",colors,pos,en
First the screen goes completely out.,screen,neg,en
I'm learning the finger options for the mousepad that allow for quicker browsing of web pages.,mousepad,pos,en
I'm learning the finger options for the mousepad that allow for quicker browsing of web pages.,browsing,pos,en
"The PhotoBooth is a great program, it takes very good pictures with the built-in camera.",PhotoBooth,pos,en
"The PhotoBooth is a great program, it takes very good pictures with the built-in camera.",program,pos,en
"The PhotoBooth is a great program, it takes very good pictures with the built-in camera.",built-in camera,pos,en
Many kinds of software that is necessary to the working person is not available and cannot be downloaded.,software,neg,en
I had to pay for the shipping!,shipping,neg,en
"It bluescreened on me without any warning, running simply basic Chrome.",Chrome,neg,en
I took 3-4 years researching brands and prices of laptops.,prices,neutral,en
We researched and found the best price at MacConnection.,price,pos,en
But guess what?  (you have to buy an external dvd drive it doesn't have a built in type) The notebook can't be used because it doesn't read anything for an external drive.,external dvd drive,neg,en
But guess what?  (you have to buy an external dvd drive it doesn't have a built in type) The notebook can't be used because it doesn't read anything for an external drive.,external drive,neg,en
GET THIS COMPUTER FOR PORTABILITY AND FAST PROCESSING!!!,PORTABILITY,pos,en
GET THIS COMPUTER FOR PORTABILITY AND FAST PROCESSING!!!,PROCESSING,pos,en
I use a cooling pad but it doesn't help.,cooling pad,neg,en
Supplied software: The software that comes with this machine is greatly welcomed compared to what Windows comes with.,Supplied software,neutral,en
Supplied software: The software that comes with this machine is greatly welcomed compared to what Windows comes with.,software,pos,en
Supplied software: The software that comes with this machine is greatly welcomed compared to what Windows comes with.,Windows,neg,en
I'm tired of the inept service.,service,neg,en
"Garageband is easy to work with, like all the other apple applications I've had experience with.",Garageband,pos,en
"Garageband is easy to work with, like all the other apple applications I've had experience with.",apple applications,pos,en
"No, tey don't even support their own bios and it ""could be a problem with the bios"" How can a company that makes a fairly decent product get away with such insanity??!!",bios,neg,en
"No, tey don't even support their own bios and it ""could be a problem with the bios"" How can a company that makes a fairly decent product get away with such insanity??!!",bios,neg,en
"Because we did not purchase the extended warranty in time, we are on the hook for the repair.",extended warranty,neg,en
"It started out by randomly ceasing to charge when it was plugged in (mousing over the battery icon would read, for example, ""74%, plugged in, not charging""), requiring me to unplug it and plug it back in several times to get it to charge.",charging,neg,en
"It started out by randomly ceasing to charge when it was plugged in (mousing over the battery icon would read, for example, ""74%, plugged in, not charging""), requiring me to unplug it and plug it back in several times to get it to charge.",charge,neg,en
"It started out by randomly ceasing to charge when it was plugged in (mousing over the battery icon would read, for example, ""74%, plugged in, not charging""), requiring me to unplug it and plug it back in several times to get it to charge.",charge,neutral,en
This laptop looked brand new and was shipped very quickly.,shipped,pos,en
"Info: Windows failed to load because the kernal is missing, or corrupt.",Windows,neg,en
"Info: Windows failed to load because the kernal is missing, or corrupt.",kernal,neg,en
"The display on this computer is the best I've seen in a very long time, the battery life is very long and very convienent.",display,pos,en
"The display on this computer is the best I've seen in a very long time, the battery life is very long and very convienent.",battery life,pos,en
"But the quality, in general was less than the worth of the cheap laptop.",quality,neg,en
In the first moth of owning this computer its hardrive failed which had to be replaced.,hardrive,neg,en
Its also FUN to use!,use,pos,en
"The graphics and screen are stunning and although I was a PC person, I was able to understand how to use a mac fairly quickly.",graphics,pos,en
"The graphics and screen are stunning and although I was a PC person, I was able to understand how to use a mac fairly quickly.",screen,pos,en
"WIth the upgraded memory, the MacBook Pro never has an issue running many many applications at once!",upgraded memory,pos,en
"WIth the upgraded memory, the MacBook Pro never has an issue running many many applications at once!",applications,neutral,en
"WIth the upgraded memory, the MacBook Pro never has an issue running many many applications at once!",running,pos,en
"Simple to use, and great graphics.",graphics,pos,en
"Simple to use, and great graphics.",use,pos,en
The internet speed is spectacular.,internet speed,pos,en
They claim call center is still down.,call center,neg,en
Mac also has many apps and programs that are quite cheap or free.,apps,pos,en
Mac also has many apps and programs that are quite cheap or free.,programs,pos,en
"My husband uses it mostly for games, email and music.",games,neutral,en
I just took the broken cords into the Apple store and they gave me new ones.,cords,pos,en
"Apparently under the screen there are 2 little screws and when the screen gets moved back and forth, they come loose.",screen,neutral,en
"Apparently under the screen there are 2 little screws and when the screen gets moved back and forth, they come loose.",screen,neutral,en
"Being a PC user my whole life, it's taking a bit of time to adapt to the OS of a Mac but I'm finding my way around.",OS,neutral,en
The computer will constantly be getting hot and burning your leg unless you go through the hassle of taking off the entire back of it just to clean out the fan.,fan,neg,en
"I have in the past gotten superfine sandpaper and ""fixed"" the edges by rounding them off.",edges,neg,en
Downfalls: sharp edges.,edges,neg,en
i needed one to be able to carry to work everyday and this one seems to fit all of the criteria.,carry,neutral,en
The screen is gorgeous - yummy good.,screen,pos,en
"Did I mention everything about it, from size to weight to keyboard screams BULK?",size,neg,en
"Did I mention everything about it, from size to weight to keyboard screams BULK?",weight,neg,en
"Did I mention everything about it, from size to weight to keyboard screams BULK?",keyboard,neg,en
I had it four months when my disc drive refused to open.,disc drive,neg,en
"So, after Apple replaced the hard drive I enjoyed another 4 months of my new computer, until it froze this morning--completely.",hard drive,neutral,en
"Once again, I was told it was the suspicious  power supply  problem.",power supply,neg,en
"The Macbook starts fast, doesn't crash, has a fantastic display, is small and light (I have the 13.3"" model), and isn't always complaining about updates, lost connections, errors, blue screens, etc.",display,pos,en
"The Macbook starts fast, doesn't crash, has a fantastic display, is small and light (I have the 13.3"" model), and isn't always complaining about updates, lost connections, errors, blue screens, etc.",starts,pos,en
Unable to boot up this brand new laptop.,boot up,neg,en
"In addition, all the design tools on Pages and Keynotes makes it much easier to create professional looking documents and presentations.",Pages,pos,en
"In addition, all the design tools on Pages and Keynotes makes it much easier to create professional looking documents and presentations.",Keynotes,pos,en
"I actually had the hard drive replaced twice, the mother board once, the dvd drive twice, then they FINALLY agreed to replace it, (ALL OF THIS IN LESS THAN 1 1/2 YEARS!",hard drive,neg,en
"I actually had the hard drive replaced twice, the mother board once, the dvd drive twice, then they FINALLY agreed to replace it, (ALL OF THIS IN LESS THAN 1 1/2 YEARS!",mother board,neg,en
"I actually had the hard drive replaced twice, the mother board once, the dvd drive twice, then they FINALLY agreed to replace it, (ALL OF THIS IN LESS THAN 1 1/2 YEARS!",dvd drive,neg,en
"The guy then said that if I insist on having the hinge tightened, they can do it for me but I have to accept the condition after the ""repair"".",hinge,neutral,en
"The port is secured to motherboard so when this  happens you can't see the plug at all, it's just gone.",motherboard,neutral,en
"The port is secured to motherboard so when this  happens you can't see the plug at all, it's just gone.",port,neutral,en
"The port is secured to motherboard so when this  happens you can't see the plug at all, it's just gone.",plug,neg,en
"I love the feel of the key board, as well as the trackpad.",key board,pos,en
"I love the feel of the key board, as well as the trackpad.",trackpad,pos,en
Now I have the best of both worlds with all of the power and ease of the Mac!,power,pos,en
Now I have the best of both worlds with all of the power and ease of the Mac!,ease,pos,en
Ease of use is just one of the benefits I love about my Mac.,use,pos,en
-Touchpad will take a bit of time to get used to.,Touchpad,neutral,en
Now the machine won't connect and Toshiba says that they did replace the connection card in May but they only warranty the repair for 30 days and now I'm out of warranty even though this has been a constant 5 month occurance since I bought the netbook.,connection card,neutral,en
Now the machine won't connect and Toshiba says that they did replace the connection card in May but they only warranty the repair for 30 days and now I'm out of warranty even though this has been a constant 5 month occurance since I bought the netbook.,warranty,neg,en
Now the machine won't connect and Toshiba says that they did replace the connection card in May but they only warranty the repair for 30 days and now I'm out of warranty even though this has been a constant 5 month occurance since I bought the netbook.,warranty,neg,en
"But, buy this model and just purchase 4GB of RAM (2x2GB for $92 or 1x4GB for $99), and save yourself $100 than the other model with 8GB of RAM.",4GB of RAM,neutral,en
"But, buy this model and just purchase 4GB of RAM (2x2GB for $92 or 1x4GB for $99), and save yourself $100 than the other model with 8GB of RAM.",8GB of RAM,neutral,en
"If you're looking for something to fly through those massive spreadsheets or play a graphics-intensive game, you'd be better off getting a machine aimed at that segment of the market.",game,neutral,en
"Browsing, also, was no problem for me when I used itunes ( which usually slows down my PC ).",Browsing,pos,en
"Browsing, also, was no problem for me when I used itunes ( which usually slows down my PC ).",itunes,pos,en
"Again, decent comp for the price, and I was in need of one quickly as my other laptop died on me.",price,pos,en
so in a brief summary i would have to say that i would not recommend dell vostro 1000 to anyone due to it being a down right awful setup so in my opinion you should steer clear of them if you want a decent laptop.,setup,neg,en
"My friend just had to replace his entire motherboard, so did my wife, and it looks like I will have to as well.",motherboard,neg,en
"Toshiba customer services will indirectly deal with your problems by constantly tranferring you from one country to another, and I am not kidding you, I called different hours of the day and you'll get someone else from another country trying to get you to tell them your life story all over again, since they make it sound like they don't have your history list of your calls right in front of them.",Toshiba customer services,neg,en
Quality Display  I was surprised with the performance and quality of this HP Laptop.,Quality Display,pos,en
Quality Display  I was surprised with the performance and quality of this HP Laptop.,performance,pos,en
Quality Display  I was surprised with the performance and quality of this HP Laptop.,quality,pos,en
The battery life also doesn't keep up with the claim but still I think macbook is much ahead from the rest of the pack.,battery life,neg,en
The internet capabilities are also very strong and picks up signals very easily.,internet capabilities,pos,en
"Its fast, has High definition quality in the videos.",High definition quality,pos,en
Another Great thing is the Beast graphics.,Beast graphics,pos,en
The ease of set up was terrific.,set up,pos,en
Everything I have tried has worked and I never have to carry the wall charger cause the battery is so awesome.,wall charger,neutral,en
Everything I have tried has worked and I never have to carry the wall charger cause the battery is so awesome.,battery,pos,en
The battery life is probably an hour at best.,battery life,neg,en
This is a review of windows vista system.,windows vista system,neutral,en
"cosmetically, the only thing they changed was 2 of the Function keys at the top.",Function keys,neutral,en
But sadly the replacement froze-up while updating the BIOS again and shut down and would not turn back on.,BIOS,neg,en
There's literally no way to make it sing with Vista.,Vista,neg,en
Screen size is perfect for portable use in any environment.,Screen size,pos,en
"First, it does not have a push button to open the lid.",push button,neg,en
"First, it does not have a push button to open the lid.",lid,neutral,en
"I used to build my own desktops from the component parts, and recently my 7 year old Pentium 4 with HT 1 GB ram SATA desktop stopped working (this was a rock star 7 years ago).",Pentium 4,neutral,en
"I used to build my own desktops from the component parts, and recently my 7 year old Pentium 4 with HT 1 GB ram SATA desktop stopped working (this was a rock star 7 years ago).",1 GB ram,neutral,en
I now realize that my $900 would have been better spent on a Windows laptop.,Windows,pos,en
) And printing from either word processor is an adventure.,word processor,neg,en
"After purchasing this thing, I find out that I need a special interface device to connect my camera, and that it cannot be purchased at the store - only on line.",interface device,neg,en
Another included program that is laughable is the chess game.,included program,neg,en
"Yes, I thought the expese was a little much, but I now realize you get what you pay for.",expese,neg,en
"It works great for general internet use, Microsoft Office apps, home bookkeeping, etc.",Microsoft Office apps,pos,en
"It works great for general internet use, Microsoft Office apps, home bookkeeping, etc.",internet use,pos,en
"The price was very good, and the product is top quality.",price,pos,en
"The price was very good, and the product is top quality.",quality,pos,en
It played various games without problems and ran aero smoothly and flawlessly.,games,neutral,en
It played various games without problems and ran aero smoothly and flawlessly.,aero,neutral,en
After replacing the hard drive the battery stopped working  (3 months of use) which was frustrating.,hard drive,neutral,en
After replacing the hard drive the battery stopped working  (3 months of use) which was frustrating.,battery,neg,en
The screen almost looked like a barcode when it froze.,screen,neg,en
"From the get-go, the M6809 was unsteady in its operation;",operation,neg,en
"Its small enough where I can take it pretty much anywhere, but still has a big enough screen to get everything done.",screen,pos,en
"It even has a great webcam, and Skype works very well.",webcam,pos,en
"It even has a great webcam, and Skype works very well.",Skype,pos,en
"I love the solid machined aluminum frame, and the keyboard is the best of any laptop I've used.",machined aluminum frame,pos,en
"I love the solid machined aluminum frame, and the keyboard is the best of any laptop I've used.",keyboard,pos,en
You can even run a parallels type program easily and run any leftover PC software that you absolutely cannot be without.,parallels type program,pos,en
You can even run a parallels type program easily and run any leftover PC software that you absolutely cannot be without.,software,pos,en
This computer I used daily nice compact design.,design,pos,en
"The ATI graphics card is a huge plus, definitely a good value if you need to be able to run some slightly older games that a Intel built-in card would have trouble with, such as Half-Life 2 or even World of Warcraft.",ATI graphics card,pos,en
"The ATI graphics card is a huge plus, definitely a good value if you need to be able to run some slightly older games that a Intel built-in card would have trouble with, such as Half-Life 2 or even World of Warcraft.",Intel built-in card,pos,en
"The ATI graphics card is a huge plus, definitely a good value if you need to be able to run some slightly older games that a Intel built-in card would have trouble with, such as Half-Life 2 or even World of Warcraft.",games,neutral,en
It was hard to handle and operate at school.,handle,neg,en
It was hard to handle and operate at school.,operate,neg,en
It has easy to use features and all the speed and power I could ask for.,features,pos,en
It has easy to use features and all the speed and power I could ask for.,speed,pos,en
It has easy to use features and all the speed and power I could ask for.,power,pos,en
"My power supply cord developed exposed wires within the first year of ownership, so it was covered by the Applecare warranty plan.",power supply cord,neg,en
"My power supply cord developed exposed wires within the first year of ownership, so it was covered by the Applecare warranty plan.",Applecare warranty plan,pos,en
I preferred the fit and feel of the 13 inch.,13 inch,pos,en
power supply went bad after 2 weeks --,power supply,neg,en
"The screen takes some getting use to, because it is smaller than the laptop.",screen,neg,en
I regret buying it before understanding how awful it is to use.,use,neg,en
The right speaker did not work.,right speaker,neg,en
Dealing with the support drone on the other end of the chat was sheer torture.,support,neg,en
"The Final Cut Pro on this laptop is so fast and easy, and I can use this to seemlessly transfer all my work to my home computer, which is also a mac.",Final Cut Pro,pos,en
"The computer runs extremely slowly, whether opening Word or My Computer.",runs,neg,en
"The Mac Snow Leopard O/S is extremely easy to use, although very different than Win XP, Visa or Win7.",Mac Snow Leopard O/S,pos,en
"The Mac Snow Leopard O/S is extremely easy to use, although very different than Win XP, Visa or Win7.",Win XP,neutral,en
"The Mac Snow Leopard O/S is extremely easy to use, although very different than Win XP, Visa or Win7.",Visa,neutral,en
